{
  "schemaVersion": 1,
  "trackVersion": "mind-eye-filler-track/1",
  "compilerVersion": "mind-eye-filler-compiler/1.0.0",
  "fillerID": "rich.filler.wait.001",
  "speakerCharacterID": "rich",
  "audioResourcePath": "Turing/Audio/rich-filler/rich-filler_wait_2.mp3",
  "audioSHA256": "99b0e1a29bd8fda4fb1a241685237d9bf556762b22c3d5b0f1c4bbe4fe8eb957",
  "descriptorSHA256": "dfb88d31b6f5656053563c86f9a629d47a3d4a467b8e5eea951d28c6722b9d6b",
  "authoring": {
    "mode": "manualTranscript",
    "transcriptSHA256": "716ecabb45ac6a88a049398fde2d3d5225c6dd3121ae9bbc5af457eb4baf056a",
    "nonverbalProfile": null
  },
  "timeline": {
    "sampleRate": 48000,
    "sampleCount": 192000,
    "durationSeconds": 4.0,
    "framesPerSecond": 60,
    "samplesPerNominalFrame": 800,
    "frameCount": 240
  },
  "mouthLayerBits": {
    "rest": 1,
    "small": 2,
    "wide": 4,
    "round": 8,
    "teeth": 16
  },
  "poseRuns": [
    {
      "startFrame": 0,
      "endFrameExclusive": 113,
      "pose": "rest",
      "evidenceMask": 37
    },
    {
      "startFrame": 113,
      "endFrameExclusive": 119,
      "pose": "round",
      "evidenceMask": 3
    },
    {
      "startFrame": 119,
      "endFrameExclusive": 129,
      "pose": "wide",
      "evidenceMask": 3
    },
    {
      "startFrame": 129,
      "endFrameExclusive": 133,
      "pose": "small",
      "evidenceMask": 3
    },
    {
      "startFrame": 133,
      "endFrameExclusive": 240,
      "pose": "rest",
      "evidenceMask": 37
    }
  ],
  "expandedFramesSHA256": "d01690bc20ca23fee28c6bceea9de6644b333b9f0ad44d5f2dc5da650c4183f3",
  "analysisProvenance": {
    "toolchainLockSHA256": "c5c57d5328fe9de6aa14f2f3b522cdd226914efb3339bac9211a9d5002f42c68",
    "compilerConfigSHA256": "06b0cb83412565c3fae1a1b29c28c1c6015c13ab9dfe7359317196a68f70a5e9",
    "phonemePoseMapSHA256": "32aaf5b5b5369d684ada94c847a26db9e6ff80b4fee97b687f47a4d9fb98470c",
    "mfaRawOutputSHA256": "68804a1b4ad5e39384a47d37a7ccb968ff26c280285c2c2ae42f700e8729b1d1",
    "nonverbalConfigurationSHA256": null
  },
  "summary": {
    "poseFrameCounts": {
      "rest": 220,
      "round": 6,
      "wide": 10,
      "small": 4
    },
    "speechFrameCount": 20,
    "fallbackFrameCount": 0,
    "manualOverrideFrameCount": 0,
    "warningCodes": []
  }
}
