{
  "schemaVersion": 1,
  "trackVersion": "mind-eye-filler-track/1",
  "compilerVersion": "mind-eye-filler-compiler/1.0.0",
  "fillerID": "rich.filler.listen.001",
  "speakerCharacterID": "rich",
  "audioResourcePath": "Turing/Audio/rich-filler/rich-filler_listen_3.mp3",
  "audioSHA256": "392eda8233338d01f41ca90a57eba2897e183e3f636f36e0eff1d9933a7edb82",
  "descriptorSHA256": "735451e45c4c6f8263b71c24e1747ef1caab14f6996200c32863d4563264bb1e",
  "authoring": {
    "mode": "manualTranscript",
    "transcriptSHA256": "6f8860eb5103a16b917146f9cbf21aa00fe7d2291b1aad7f4fe83a6db71688cf",
    "nonverbalProfile": null
  },
  "timeline": {
    "sampleRate": 48000,
    "sampleCount": 192000,
    "durationSeconds": 4.0,
    "framesPerSecond": 60,
    "samplesPerNominalFrame": 800,
    "frameCount": 240
  },
  "mouthLayerBits": {
    "rest": 1,
    "small": 2,
    "wide": 4,
    "round": 8,
    "teeth": 16
  },
  "poseRuns": [
    {
      "startFrame": 0,
      "endFrameExclusive": 110,
      "pose": "rest",
      "evidenceMask": 37
    },
    {
      "startFrame": 110,
      "endFrameExclusive": 114,
      "pose": "small",
      "evidenceMask": 3
    },
    {
      "startFrame": 114,
      "endFrameExclusive": 118,
      "pose": "wide",
      "evidenceMask": 3
    },
    {
      "startFrame": 118,
      "endFrameExclusive": 125,
      "pose": "teeth",
      "evidenceMask": 19
    },
    {
      "startFrame": 125,
      "endFrameExclusive": 131,
      "pose": "wide",
      "evidenceMask": 3
    },
    {
      "startFrame": 131,
      "endFrameExclusive": 145,
      "pose": "small",
      "evidenceMask": 3
    },
    {
      "startFrame": 145,
      "endFrameExclusive": 240,
      "pose": "rest",
      "evidenceMask": 5
    }
  ],
  "expandedFramesSHA256": "a54ed167f0eec8eca2074da20396e0e61ffa3f89a2b47c44bc4bf9a3f1b03f6e",
  "analysisProvenance": {
    "toolchainLockSHA256": "c5c57d5328fe9de6aa14f2f3b522cdd226914efb3339bac9211a9d5002f42c68",
    "compilerConfigSHA256": "06b0cb83412565c3fae1a1b29c28c1c6015c13ab9dfe7359317196a68f70a5e9",
    "phonemePoseMapSHA256": "32aaf5b5b5369d684ada94c847a26db9e6ff80b4fee97b687f47a4d9fb98470c",
    "mfaRawOutputSHA256": "87ab15ecafdc80434c88df9489b9d2db28d625e07a402a13d23e52f937d17243",
    "nonverbalConfigurationSHA256": null
  },
  "summary": {
    "poseFrameCounts": {
      "rest": 205,
      "small": 18,
      "wide": 10,
      "teeth": 7
    },
    "speechFrameCount": 35,
    "fallbackFrameCount": 0,
    "manualOverrideFrameCount": 0,
    "warningCodes": []
  }
}
