{
  "schemaVersion": 1,
  "trackVersion": "mind-eye-filler-track/1",
  "compilerVersion": "mind-eye-filler-compiler/1.0.0",
  "fillerID": "big_mike.filler.mm.001",
  "speakerCharacterID": "big_mike",
  "audioResourcePath": "Turing/Audio/big-mike-filler/big-mike-filler_mm_7.mp3",
  "audioSHA256": "e53af52d4574db3f4da71a94d648e9eac79a59ed473cbb0b48b4d8db68034e02",
  "descriptorSHA256": "344d297562213e81bb9c53c7ff01bc48bf63db1b652e54dcbaa6099e03bcf6d9",
  "authoring": {
    "mode": "nonverbal",
    "transcriptSHA256": null,
    "nonverbalProfile": "closedHum"
  },
  "timeline": {
    "sampleRate": 48000,
    "sampleCount": 192000,
    "durationSeconds": 4.0,
    "framesPerSecond": 60,
    "samplesPerNominalFrame": 800,
    "frameCount": 240
  },
  "mouthLayerBits": {
    "rest": 1,
    "small": 2,
    "wide": 4,
    "round": 8,
    "teeth": 16
  },
  "poseRuns": [
    {
      "startFrame": 0,
      "endFrameExclusive": 77,
      "pose": "rest",
      "evidenceMask": 0
    },
    {
      "startFrame": 77,
      "endFrameExclusive": 82,
      "pose": "small",
      "evidenceMask": 51
    },
    {
      "startFrame": 82,
      "endFrameExclusive": 113,
      "pose": "rest",
      "evidenceMask": 0
    },
    {
      "startFrame": 113,
      "endFrameExclusive": 146,
      "pose": "small",
      "evidenceMask": 51
    },
    {
      "startFrame": 146,
      "endFrameExclusive": 178,
      "pose": "rest",
      "evidenceMask": 0
    },
    {
      "startFrame": 178,
      "endFrameExclusive": 188,
      "pose": "small",
      "evidenceMask": 51
    },
    {
      "startFrame": 188,
      "endFrameExclusive": 191,
      "pose": "rest",
      "evidenceMask": 0
    },
    {
      "startFrame": 191,
      "endFrameExclusive": 196,
      "pose": "small",
      "evidenceMask": 51
    },
    {
      "startFrame": 196,
      "endFrameExclusive": 240,
      "pose": "rest",
      "evidenceMask": 0
    }
  ],
  "expandedFramesSHA256": "27836f62b61a32c405e4cb9cfcf282f44fa66d21c4c09903428ac04524b2ee70",
  "analysisProvenance": {
    "toolchainLockSHA256": "c5c57d5328fe9de6aa14f2f3b522cdd226914efb3339bac9211a9d5002f42c68",
    "compilerConfigSHA256": "06b0cb83412565c3fae1a1b29c28c1c6015c13ab9dfe7359317196a68f70a5e9",
    "phonemePoseMapSHA256": "32aaf5b5b5369d684ada94c847a26db9e6ff80b4fee97b687f47a4d9fb98470c",
    "mfaRawOutputSHA256": null,
    "nonverbalConfigurationSHA256": "e74813e844a816001a953e82942669e360b029138d312f5b09ad54f4fa41a401"
  },
  "summary": {
    "poseFrameCounts": {
      "rest": 187,
      "small": 53
    },
    "speechFrameCount": 53,
    "fallbackFrameCount": 0,
    "manualOverrideFrameCount": 0,
    "warningCodes": []
  }
}
