{
  "schemaVersion": 1,
  "trackVersion": "mind-eye-filler-track/1",
  "compilerVersion": "mind-eye-filler-compiler/1.0.0",
  "fillerID": "big_mike.filler.alright_alright_alright.001",
  "speakerCharacterID": "big_mike",
  "audioResourcePath": "Turing/Audio/big-mike-filler/big-mike-filler-alright_alright-alright_1.mp3",
  "audioSHA256": "6e1112b5670b059ad5d8bff1541ab66b35605163e691bc6c1f0dec5c48cb26a8",
  "descriptorSHA256": "744b7f5689f9b06d7a6f34bed195db76e8243497fad05c917fcfe817f167b45c",
  "authoring": {
    "mode": "manualTranscript",
    "transcriptSHA256": "ac20037066ee5ac67689dbd307468bda394dee8a3f3fef8c32a7ca51456dd8ff",
    "nonverbalProfile": null
  },
  "timeline": {
    "sampleRate": 48000,
    "sampleCount": 192000,
    "durationSeconds": 4.0,
    "framesPerSecond": 60,
    "samplesPerNominalFrame": 800,
    "frameCount": 240
  },
  "mouthLayerBits": {
    "rest": 1,
    "small": 2,
    "wide": 4,
    "round": 8,
    "teeth": 16
  },
  "poseRuns": [
    {
      "startFrame": 0,
      "endFrameExclusive": 88,
      "pose": "rest",
      "evidenceMask": 37
    },
    {
      "startFrame": 88,
      "endFrameExclusive": 91,
      "pose": "round",
      "evidenceMask": 3
    },
    {
      "startFrame": 91,
      "endFrameExclusive": 101,
      "pose": "small",
      "evidenceMask": 3
    },
    {
      "startFrame": 101,
      "endFrameExclusive": 110,
      "pose": "wide",
      "evidenceMask": 3
    },
    {
      "startFrame": 110,
      "endFrameExclusive": 112,
      "pose": "small",
      "evidenceMask": 3
    },
    {
      "startFrame": 112,
      "endFrameExclusive": 118,
      "pose": "round",
      "evidenceMask": 19
    },
    {
      "startFrame": 118,
      "endFrameExclusive": 128,
      "pose": "small",
      "evidenceMask": 3
    },
    {
      "startFrame": 128,
      "endFrameExclusive": 136,
      "pose": "wide",
      "evidenceMask": 3
    },
    {
      "startFrame": 136,
      "endFrameExclusive": 141,
      "pose": "round",
      "evidenceMask": 19
    },
    {
      "startFrame": 141,
      "endFrameExclusive": 154,
      "pose": "small",
      "evidenceMask": 3
    },
    {
      "startFrame": 154,
      "endFrameExclusive": 162,
      "pose": "wide",
      "evidenceMask": 3
    },
    {
      "startFrame": 162,
      "endFrameExclusive": 164,
      "pose": "small",
      "evidenceMask": 3
    },
    {
      "startFrame": 164,
      "endFrameExclusive": 240,
      "pose": "rest",
      "evidenceMask": 37
    }
  ],
  "expandedFramesSHA256": "4fe90cca5e502ac05447ff05decab74987b1de1ca3c7e5a7532a70b739a64406",
  "analysisProvenance": {
    "toolchainLockSHA256": "c5c57d5328fe9de6aa14f2f3b522cdd226914efb3339bac9211a9d5002f42c68",
    "compilerConfigSHA256": "06b0cb83412565c3fae1a1b29c28c1c6015c13ab9dfe7359317196a68f70a5e9",
    "phonemePoseMapSHA256": "32aaf5b5b5369d684ada94c847a26db9e6ff80b4fee97b687f47a4d9fb98470c",
    "mfaRawOutputSHA256": "094955ca696dcb73fc1be7f22583b5d2acce4f9ce05420d532f7bff7f331cda4",
    "nonverbalConfigurationSHA256": null
  },
  "summary": {
    "poseFrameCounts": {
      "rest": 164,
      "round": 14,
      "small": 37,
      "wide": 25
    },
    "speechFrameCount": 76,
    "fallbackFrameCount": 0,
    "manualOverrideFrameCount": 0,
    "warningCodes": []
  }
}
