{
  "schemaVersion": 1,
  "trackVersion": "mind-eye-filler-track/1",
  "compilerVersion": "mind-eye-filler-compiler/1.0.0",
  "fillerID": "big_mike.filler.wait.001",
  "speakerCharacterID": "big_mike",
  "audioResourcePath": "Turing/Audio/big-mike-filler/big-mike-filler_wait_2.mp3",
  "audioSHA256": "aa9a0aa1d16e9909a2f24acd265d73f09db6dab5555e9659e21c045667e2854b",
  "descriptorSHA256": "f8202805a3b5447c9d5f340dfc8731a1976b92a24270e20b3214f359bcb49f31",
  "authoring": {
    "mode": "manualTranscript",
    "transcriptSHA256": "716ecabb45ac6a88a049398fde2d3d5225c6dd3121ae9bbc5af457eb4baf056a",
    "nonverbalProfile": null
  },
  "timeline": {
    "sampleRate": 48000,
    "sampleCount": 192000,
    "durationSeconds": 4.0,
    "framesPerSecond": 60,
    "samplesPerNominalFrame": 800,
    "frameCount": 240
  },
  "mouthLayerBits": {
    "rest": 1,
    "small": 2,
    "wide": 4,
    "round": 8,
    "teeth": 16
  },
  "poseRuns": [
    {
      "startFrame": 0,
      "endFrameExclusive": 108,
      "pose": "rest",
      "evidenceMask": 37
    },
    {
      "startFrame": 108,
      "endFrameExclusive": 117,
      "pose": "round",
      "evidenceMask": 3
    },
    {
      "startFrame": 117,
      "endFrameExclusive": 127,
      "pose": "wide",
      "evidenceMask": 3
    },
    {
      "startFrame": 127,
      "endFrameExclusive": 131,
      "pose": "small",
      "evidenceMask": 3
    },
    {
      "startFrame": 131,
      "endFrameExclusive": 240,
      "pose": "rest",
      "evidenceMask": 37
    }
  ],
  "expandedFramesSHA256": "94c6ef9a580e270b6e8b2ab2f4c03e4ea8d7d616640a9e75025f9dd7f3cecadd",
  "analysisProvenance": {
    "toolchainLockSHA256": "c5c57d5328fe9de6aa14f2f3b522cdd226914efb3339bac9211a9d5002f42c68",
    "compilerConfigSHA256": "06b0cb83412565c3fae1a1b29c28c1c6015c13ab9dfe7359317196a68f70a5e9",
    "phonemePoseMapSHA256": "32aaf5b5b5369d684ada94c847a26db9e6ff80b4fee97b687f47a4d9fb98470c",
    "mfaRawOutputSHA256": "f0441b8216b4e1a4017decf70eff6d15d73d2f7dc92e1cbf1378535a2fe2c4ec",
    "nonverbalConfigurationSHA256": null
  },
  "summary": {
    "poseFrameCounts": {
      "rest": 217,
      "round": 9,
      "wide": 10,
      "small": 4
    },
    "speechFrameCount": 23,
    "fallbackFrameCount": 0,
    "manualOverrideFrameCount": 0,
    "warningCodes": []
  }
}
