{
  "schemaVersion": 1,
  "trackVersion": "mind-eye-filler-track/1",
  "compilerVersion": "mind-eye-filler-compiler/1.0.0",
  "fillerID": "big_mike.filler.alright.001",
  "speakerCharacterID": "big_mike",
  "audioResourcePath": "Turing/Audio/big-mike-filler/big-mike-filler_alright_2.mp3",
  "audioSHA256": "83d79f2e4cc218e300d0ebc7f7032b72063c042ee69e201c9f7ab7de9e1ac92e",
  "descriptorSHA256": "524f25579e9de9f3f5ca81dc2fb4811ff5eafa1a7a1d2b3a4834714346f0edaf",
  "authoring": {
    "mode": "manualTranscript",
    "transcriptSHA256": "b8a9dc73f1e1af5b1c0871e2b8695f56b83861190ed1c2dc90c32c65318dfa05",
    "nonverbalProfile": null
  },
  "timeline": {
    "sampleRate": 48000,
    "sampleCount": 192000,
    "durationSeconds": 4.0,
    "framesPerSecond": 60,
    "samplesPerNominalFrame": 800,
    "frameCount": 240
  },
  "mouthLayerBits": {
    "rest": 1,
    "small": 2,
    "wide": 4,
    "round": 8,
    "teeth": 16
  },
  "poseRuns": [
    {
      "startFrame": 0,
      "endFrameExclusive": 106,
      "pose": "rest",
      "evidenceMask": 37
    },
    {
      "startFrame": 106,
      "endFrameExclusive": 109,
      "pose": "round",
      "evidenceMask": 19
    },
    {
      "startFrame": 109,
      "endFrameExclusive": 142,
      "pose": "small",
      "evidenceMask": 19
    },
    {
      "startFrame": 142,
      "endFrameExclusive": 240,
      "pose": "rest",
      "evidenceMask": 5
    }
  ],
  "expandedFramesSHA256": "4403cb593bdf78c0fa8c7c34fb2b6537b502a213c77de84eb581bf78bb793d23",
  "analysisProvenance": {
    "toolchainLockSHA256": "c5c57d5328fe9de6aa14f2f3b522cdd226914efb3339bac9211a9d5002f42c68",
    "compilerConfigSHA256": "06b0cb83412565c3fae1a1b29c28c1c6015c13ab9dfe7359317196a68f70a5e9",
    "phonemePoseMapSHA256": "32aaf5b5b5369d684ada94c847a26db9e6ff80b4fee97b687f47a4d9fb98470c",
    "mfaRawOutputSHA256": "86db96af4fc574fb3484274040249c14b726942819e090973ff8735455bdca46",
    "nonverbalConfigurationSHA256": null
  },
  "summary": {
    "poseFrameCounts": {
      "rest": 204,
      "round": 3,
      "small": 33
    },
    "speechFrameCount": 36,
    "fallbackFrameCount": 0,
    "manualOverrideFrameCount": 0,
    "warningCodes": []
  }
}
